{
  "title": "PIMP Activation",
  "concept_summary": "Built as americana with country storytelling, it stays with someone trying not to name a wrong thing too clearly. The pressure comes from trying not to name it wrong or right while both people know better. It leaves the release in the line kept blurred and unresolved.",
  "signal_stack": {
    "identity": "someone trying not to call it wrong while knowing better",
    "emotional_arc": "Pull -> hesitation -> unresolved blur",
    "genre_framework": "Americana with country storytelling",
    "production_layer": "guitar-led bed, close-held lead vocal",
    "structure": [
      "Intro",
      "Verse 1",
      "Pre-Chorus",
      "Chorus",
      "Bridge",
      "Outro"
    ]
  },
  "lyrics": "[Intro]\nlate-night drive\nboth knew better\n\n[Verse 1]\nhands on the steering wheel too tight\nkeep lookin' straight ahead through it\nphone lighting up but ignored\n\n[Pre-Chorus]\nboth knew better\nstill nobody says what that makes it\nphone lighting up but ignored\n\n[Chorus]\nboth knew better\nstill let the phone ring out\n\n[Bridge]\nain't callin' it clean\njust let the phone ring out again\n\n[Outro]\nphone lighting up but ignored\nboth knew better",
  "style_prompt": "americana with country storytelling, close lead vocal, careful and unresolved, pull, hesitation, unresolved blur, guitar-led bed, close-held lead vocal",
  "style_prompt_char_count": 151,
  "validation_notes": {
    "formatting_pass": true,
    "style_limit_pass": true,
    "anti_trope_pass": true,
    "warnings": [
      "parser_recovery: rawUserIntent=inferred, desiredDirection=normalized, possibleGenreFramework=normalized, vocalDirection=missing, instrumentationHints=missing, specialConstraints=normalized",
      "parser_overall: recovered",
      "production_layer=inferred"
    ]
  }
}