{
  "title": "PIMP Activation",
  "concept_summary": "Built as slow americana, it stays with someone letting the porch become a habit of waiting. The pressure comes from waiting made tense by what never arrives. It leaves the release in waiting left in place instead of closure.",
  "signal_stack": {
    "identity": "someone making a habit out of waiting on the porch",
    "emotional_arc": "Waiting -> repetition -> absence still running the room",
    "genre_framework": "slow americana, maybe a little southern gothic feel but subtle",
    "production_layer": "guitar-led bed, close-held lead vocal",
    "structure": [
      "Intro",
      "Verse 1",
      "Pre-Chorus",
      "Chorus",
      "Bridge",
      "Outro"
    ]
  },
  "lyrics": "[Intro]\nporch light buzzing\ntruck that never pulls in\n\n[Verse 1]\nporch light buzzing\nbugs hitting the bulb\nsame porch, same waitin'\n\n[Pre-Chorus]\nempty chair\ntruck that never pulls in\nabsence keeps the whole thing moving\n\n[Chorus]\ntruck that never pulls in\nporch light still on\n\n[Bridge]\nain't much to tell in it\nstill the light stays on\n\n[Outro]\nporch light buzzing\ntruck that never pulls in",
  "style_prompt": "slow americana, maybe a little southern gothic feel but subtle, close lead vocal, restrained and watchful, waiting, repetition, absence running the room, guitar-led bed, close-held lead vocal",
  "style_prompt_char_count": 191,
  "validation_notes": {
    "formatting_pass": true,
    "style_limit_pass": true,
    "anti_trope_pass": true,
    "warnings": [
      "parser_recovery: rawUserIntent=inferred, desiredDirection=normalized, possibleGenreFramework=normalized, vocalDirection=missing, instrumentationHints=missing, specialConstraints=normalized",
      "parser_overall: recovered",
      "production_layer=inferred"
    ]
  }
}