{
  "title": "PIMP Activation",
  "concept_summary": "Built as upbeat heartland rock or light country rock, something that could almost pass as feel-good if you don’t listen closely, it stays with narrator identity partially specified, preserve a grounded human point of view. The pressure comes from unresolved pressure that remains only partially specified. It leaves the release in intentional restraint while the source detail stays limited.",
  "signal_stack": {
    "identity": "Narrator identity partially specified; preserve a grounded human point of view",
    "emotional_arc": "contrast between public persona and private reality -> not sad on the surface -> almost upbeat delivery but wrong underneath",
    "genre_framework": "upbeat heartland rock or light country rock, something that could almost pass as feel-good if you don’t listen closely",
    "production_layer": "guitar-led bed, close dry lead vocal",
    "structure": [
      "Intro",
      "Verse 1",
      "Pre-Chorus",
      "Chorus",
      "Bridge",
      "Outro"
    ]
  },
  "lyrics": "[Intro]\nvending machine light buzzing\nhe laughs a second too long\n\n[Verse 1]\nclocking in\n- contrast between public persona and private reality\n- not sad on the surface\n- almost upbeat delivery but wrong underneath\nNarrator identity partially specified; preserve a grounded human point of view\n\n[Pre-Chorus]\nbreak room laughter\nclocking in\nkeeps holdin' onto what should've gone quiet\n\n[Chorus]\nvending machine light buzzing\nkeeps sayin' he's fine plain and low\n\n[Bridge]\nAin't nobody left to blame in it\nstill does the one thing he said he'd quit\n\n[Outro]\nvending machine light buzzing\nbreak room laughter",
  "style_prompt": "upbeat heartland rock or light country rock, something that could almost pass as feel-good if you don’t listen closely, Narrator identity partially specified; preserve a grounded human point of view, guitar-led bed, close dry lead vocal",
  "style_prompt_char_count": 236,
  "validation_notes": {
    "formatting_pass": true,
    "style_limit_pass": true,
    "anti_trope_pass": true,
    "warnings": [
      "parser_recovery: rawUserIntent=inferred, desiredDirection=normalized, possibleGenreFramework=normalized, vocalDirection=missing, instrumentationHints=missing, specialConstraints=normalized",
      "parser_overall: recovered",
      "production_layer=inferred"
    ]
  }
}