{
  "title": "County Line Pews",
  "concept_summary": "Built as americana / heartland-adjacent, it stays with a practical man sitting uneasy in church. The pressure comes from ritual pressure on a practical man carrying what he kept quiet. It leaves the release in silence, non-participation, and what he still does not say.",
  "signal_stack": {
    "identity": "blue-collar man used to practical fixes; uneasy in church with belief still catching; older-brother figure carrying what he kept quiet; morally trapped by what he cannot fix",
    "emotional_arc": "Belief residue -> ritual discomfort -> withheld confession",
    "genre_framework": "Americana / heartland-adjacent with southern-gospel shadow",
    "production_layer": "steady guitar bed, held-in lead vocal, low harmony shadow",
    "structure": [
      "Intro",
      "Verse 1",
      "Pre-Chorus",
      "Chorus",
      "Bridge",
      "Outro"
    ]
  },
  "lyrics": "[Intro]\nfolded bulletin in his fist\nhymn he can't quite sing\n\n[Verse 1]\nmud still dried on work boots\nkept his mouth shut when it counted most\nhands that know a wrench ain't good for this\n\n[Pre-Chorus]\ncounty line / two-lane / ditch water / sheriff lights way back in memory\nroom gets quiet and it all comes back\nlets it pass when it gets to him\n\n[Chorus]\ncommunion tray comin' closer\nhe lets it pass\nthat hymn stays caught halfway back\n\n[Bridge]\ncould tell it plain, still don't\ntray gets to his row, he keeps his hands down\n\n[Outro]\nfolded bulletin in his fist\ntray goes by and he don't move",
  "style_prompt": "americana / heartland-adjacent with southern-gospel shadow, blue-collar male lead, held-in and worn, belief-fracture, ritual discomfort, withheld confession, restrained posture, guilt under the surface, worn-down energy, moral pressure in close quarters, steady guitar bed, held-in lead vocal, low harmony shadow, communion tray as recurring hook image, no murder-ballad framing, no revenge framing",
  "style_prompt_char_count": 398,
  "validation_notes": {
    "formatting_pass": true,
    "style_limit_pass": true,
    "anti_trope_pass": true,
    "warnings": [
      "parser_recovery: rawUserIntent=normalized, desiredDirection=normalized, possibleGenreFramework=normalized, vocalDirection=inferred, instrumentationHints=missing, specialConstraints=normalized",
      "parser_overall: recovered",
      "production_layer=inferred"
    ]
  }
}