{
  "title": "Baby Brother",
  "concept_summary": "A soft, intimate memorial ballad told from the perspective of an older sister reflecting on childhood mischief, teenage trouble, and the unbearable finality of losing her brother to war. The identity is tender and personal, the dominant tension is love colliding with irreversible loss, and the release comes as quiet devastation rather than dramatic catharsis.",
  "signal_stack": {
    "identity": "Older sister narrator; nurturing, reflective, protective, deeply personal",
    "emotional_arc": "Warm memory -> playful youth -> worried affection -> dread -> irreversible grief",
    "genre_framework": "Acoustic memorial ballad with folk-country intimacy and restrained cinematic sorrow",
    "production_layer": "Soft acoustic guitar, close piano, low cello, restrained strings, delicate dynamics, intimate vocal presence",
    "structure": [
      "Intro",
      "Verse 1",
      "Verse 2",
      "Pre-Chorus",
      "Chorus",
      "Verse 3",
      "Bridge",
      "Final Chorus",
      "Outro"
    ]
  },
  "lyrics": "[Intro]\n(soft acoustic guitar, faint room tone, close-mic vocal)\nYou came in hollerin', red-faced and wild,\nMama laughed from the rocker, said, \"that one's gonna test us awhile\"\n\n[Verse 1]\nI was a few years older, thought I knew how to steer,\nyou were barefoot in the kitchen with toy cars in high gear\nthrowin' fits at the screen door, then grinnin' by the sink,\nand Mama'd send me after you when you'd tear off mad again\n\n[Verse 2]\nThen came flashlight summers and girls in the passenger seat,\nyour stereo too loud on our dead-end street\nblue lights in the rearview, your number on my screen,\nand I'd wait up hearin' gravel till your truck rolled in\n\n[Pre-Chorus]\nThen the haircut got shorter, the duffel got packed,\nand I quit tellin' you be careful 'fore you even backed out\n\n[Chorus]\nBaby Brother, you were trouble and light,\nmud on the floorboards, back door bangin' at night,\nyou made us mad, made us laugh, kept this whole house awake,\nnow I talk to your picture at the end of every day\n\n[Verse 3]\nThen came boots, short hair, and a plane headin' east,\nfolded shirts in a duffel where your old ball cap used to be\nyou said you'd be fine like boys say easy things,\nand I stood there in the driveway after you pulled away\n\n[Bridge]\n(low cello enters, vocal more fragile)\nThey brought you home in polished wood,\nflag pulled tight where your shoulders should've stood\nTwenty-one shots cut holes through the sky,\nand Mama held my hand so hard I wore the mark till night\n\n[Final Chorus]\nBaby Brother, you were trouble and light,\nscreen door bangin' and a porch lamp in the night,\nyou made us mad, made us laugh, made this house alive,\nnow I say your name so some part of you survives\n\n[Outro]\n(soft piano, near-whisper vocal)\nYour boots ain't moved\nMama still leaves that light on",
  "style_prompt": "Soft acoustic memorial ballad with folk-country intimacy and restrained cinematic sorrow, tender female vocal sung close and emotionally honest, acoustic guitar and soft piano upfront, low cello and gentle strings entering gradually, minimal percussion, warm natural room tone, human lived-detail lyric feel, reflective childhood memories turning into military loss and quiet devastation, intimate mix, clear lead vocal, emotional build without melodrama, grounded grief, slow dynamic rise, delicate and deeply personal, no generic military imagery, no vague grief phrasing, older-sister point of view stays central, quiet devastation without theatrical oversell",
  "style_prompt_char_count": 662,
  "validation_notes": {
    "formatting_pass": true,
    "style_limit_pass": true,
    "anti_trope_pass": true,
    "warnings": [
      "none"
    ]
  }
}